en_term;en_desc;vi_term;vi_desc
Weight average cost of capital;Ex: A weighted average of the after-tax required rates of return on a company's common stock, preferred stock, and long-term debt, where the weights are the fraction of each source of financing in the company's target capital structure.;Chi phí vốn bình quân gia quyền;Là chi phí bình quân gia quyền của suất sinh lợi sau thuế đối với cổ phiếu phổ thông, cổ phiếu ưu đãi, và nợ dài hạn, trong đó trọng số của từng loại vốn là tỷ lệ mục tiêu trong cấu trúc vốn của công ty.
Weighted average cost method;Ex: An inventory accounting method that averages the total cost of available inventory items over the total units available for sale.;Phương pháp khấu hao bình quân;Là phương phương khấu hao phân bổ chi phí bình quân của tất cả hàng tồn kho sẵn có cho tổng số đơn vị hàng tồn kho.
Welfare and reward fund;;Quỹ khen thưởng và phúc lợi;
Wholesale price index;Ex: Reflects the price changes experienced by domestic producers in a country.;Chỉ số giá bán sỉ;Là chỉ số phản ánh sự thay đổi của giá đối với các nhà sản xuất trong nước của 1 quốc gia.
Work in progress;;Chi phí sản xuất kinh doanh dở dang;
Working capital management;Ex: The management of a company's short-term assets (such... as inventory) and short-term liabilities (such as money owed to suppliers).;Quản lý vốn lưu động;Là việc quản trị tài sản ngắn hạn như hàng tồn kho và các khoản nợ ngắn hạn như phải trả người bán.
Working capital;;Vốn lưu động (hoạt động);
Working capital;Ex: The difference between current assets and current liabilities.;Vốn lưu động;bằng tài sản ngắn hạn trừ nợ ngắn hạn.
Yield spread;Ex: The difference between the yield on a bond and the yield on a default-free security, usually a government note, of the same maturity. The yield spread is primarily determined by the market's perception of the credit risk on the bond.;Chênh lệch lãi suất trái phiếu;Là sự khác biệt giữa lãi suất của một trái phiếu thông thường và lãi suất của trái phiếu chính phủ có cùng thời gian đáo hạn. Chênh lệch trái tức được xác định trước tiên bởi kỳ vọng của thị trường về rủi ro tín nhiệm của trái phiếu.
Yield to maturity;Ex: The annual return that an investor earns on a bond if the investor purchases the bond today and holds it until maturity.;Lãi suất trái phiếu đến đáo hạn;Là lãi suất hằng năm nhà đầu tư nhận được từ trái phiếu nếu nhà đầu tư mua trái phiếu ngày hôm nay và giữ nó cho đến lúc đáo hạn.
